sentence	is_counterfactual
Der Hype um das Spielchen kam wohl u. a. auf Grund eines Spiegel-Artikels zu Stande, und die &#34;müssen es ja wissen&#34;	0
"""Also kommt man relativ schnell zu dem Punkt, an dem man sich überlegt, ob es nicht sinnvoll wäre einen entsprechenden Batteriegriff zu erwerben, der die verfügbare Energiemenge verdoppelt und zusätzlich auch die Möglichkeit eröffnet alternativ AA-Batterien/Akkus zu verwenden - kann im Urlaub schon mal die letzte Möglichkeit sein an \\""""Strom\\"""" zu kommen."""	1
Natürlich könnte man ketzerisch behaupten, dass sich OMD seit den 80ern nicht weiter entwickelt hätten.	1
Die Treiber müssen zwar von der Homepage heruntergeladen werden, aber man sollte eh stets den aktuellen Treiber von der Homepage statt von der CD nehmen, daher voll OK, spart zudem Ressourcen.	0
Ob 30€ wirklich sein müssen stelle ich mal so dahin, mir hilft es aber sehr oft weiter.	0
Film online zu sehen wäre schön, wenn die Datenrate es erlauben würde.	1
Zudem wäre dann auch der störende Punkt des Signals gelöst, da dann alles im gleichen WLAN-Netzwerk läuft.	1
Müsste ich die CD noch mit in meine Bewertung einbeziehen, wären es deutlich weniger.	1
Betreiben tue ich den Prozessor auf einem ASUS Mainboard mit Corsair Arbeitsspeicher (16 GB, 1600 mHz) und statt dem orginalen, mit einem Arctic UCACO Lüfter für 12,99. .	0
Eine Reihe von seltsamen Gehirnwindungen, die an sich an jede Geschichte dieser Welt anlehnen könnte.Es war eine einzige Quälerei dieses Buch zu lesen.	1
Typischer gitarrensound und glattgebügelter gesamtsound, hätte frecher klingen können und müssen meiner Meinung nach.	1
Ich mochte weder Ana noch Christian, finde beide hochgradig gestört und hätte beide am liebsten in eine geschlossene Anstalt geschickt, damit sie sich dort erst mal mit ihren Problemen auseinandersetzen, ehe sie auch nur ansatzweise an eine Beziehung denken.	1
Es gibt keinen Titel, den hervorzuheben wäre.	1
Das beschreibt die ersten 30 Minuten des Films, die man gut und gerne wohl hätte einkürzen können.	1
Hat mir sehr gefallen, Angelina Jolie spielt ihre Rolle der bösen Hexe sehr gut auch wenn es kein Action Thriller ist, kann man sich die Aktion mit der ganzen Familie ansehen.	1
Jedoch befürchte ich, dass die Generationen nach mir es etwas falsch verstehen könnte.	1
Die Charakteren sind hier recht nett dargestellt, aber ansonsten fehlt es dem Film an Inhalt und Intensit&auml;t. Selbst die ganzen Action Sequenzen und zuweil dummen Spr&uuml;che machen es nicht besser.	0
Geschwindigkeiten messe ich meistens nicht, aber es wäre schon aufgefallen, wenn er sich besonders lang Zeit lassen würde.	1
Um sicher zu sein, dass es nicht an FB liegt, hätte ich die Einstellungen der LiveView App löschen müssen, was ich aber ließ, da mir die Funktion nicht so wichtig ist.	1
Also, fix bestellt und hoffnungsfroh die Kohle &uuml;berwiesen -man k&ouml;nnte ja sonst etwas verpassen.. .	1
Der Film ist eigentlich nicht total schlecht wenn man über viele Fehler hinwegsieht.	0
Bis zum vorletzten Song hätte ich kaum mehr als 1 Stern vergeben, denn wer wie diese Band hohe Maßstäbe setzen kann, den messe ich gnadenlos daran.	1
"""Lies Greed Misery 5/5 - Hätte gut auf \\""""Meteora\\"""" gepasst, wunderbares Stück wie ich finde."""	1
Auf kurz oder lang wird man aber ohnehin in einen Großen Werkzeugkoffer investieren müssen, damit man noch mehr Arbeiten verrichten kann.	0
Nur Peanut-Szenen hätte ich mehr erwartet.	1
Treppenabgang mit Menschengedränge, wo die Kamera nahe am Körper anliegt und ungünstig an eine Mauer gedrückt werden könnte.	1
"""Alles wirkt kalt und unnahbar, halt wie in der \\""""Matrix\\"""" und ich stimme dem Charakter Fischer (Cillian Murphy) zu, wenn er sagt, dass man anstatt in eine Eiswüste ruhig an einen karibischen Strand hätte gehen können."""	1
Anfangs hatte ich bedenken, dass es mit der Hülle etwas umständlich werden könnte.	1
So wie wires wünschen in unserem Alter und aus unserer Zeit-	0
Unnötige Längen an Stellen, die man hätte nur anreißen müssen, dann wieder Handlungen, die Ausführlicher behandelt werden sollten.	1
Besser wäre allerdings, wenn ein Fach (zum Beispiel das hinterste) etwas breiter wäre, um auch dickere Dinge oder flache Schachteln aufzunehmen.	1
schlecht, merkwürdig, gewollt und nix gekonnt - war aber schön noch einmal ein film mit  heath ledger zu sehen 1	0
Gitarren und Drums sind klar vom Bass zu unterscheiden und klingen, wie von der Band gewollt (wenn man das so sagen kann).	0
aber der Vorgänger hat mir doch noch ein wenig besser gefallen..ich vermisse etwas die Härte!	0
Hätte niemals erwartet dass die Serie so gut ist.	1
Außerdem könnte man die Kamera als günstige Überwachungskamera einsetzen.	1
Wenn ein Gerät schon den Namen Game Pad hat, dann hätte ich auch erwartet, dass Spiele vorinstalliert sind.	1
Der Preis könnte niedriger sein daher &#34;nur&#34; 4 Sterne.	1
Vielleicht wäre es dann etwas spannender geworden.	1
Die Charaktere sind mir, wie bereits gesagt, zu wenig scharf/tief und es fehlt ihnen und auch der Story an Glaubwürdigkeit.	0
Ich hatte es eigentlich dafür gedacht auf Arbeit den mp3-Player im Handy fernzusteuern ohne das Telefon ständig aus der Tasche nehmen zu müssen.	0
Zu gönnen wäre es ihm ja!	1
"""Anstelle von \\""""The pants stay on\\"""" hätte ich eine der Powernummern \\""""Don't wait up\\"""" oder \\""""Pleasure zone\\"""" bevorzugt."""	1
Ma darf die Jungs nicht mit vor 40 Jahren vergleichen, sie machen immer noch echt gute Musik und sind sich treu geblieben, aber das &#34;Feuer&#34;, das vermisse ich schon, viele Stücke sind mir zu gefällig und Gillan ist mir zu präsent, er sollte mal mehr Airey und Morse ranlassen, die beiden sind im Wechselspiel wie in alten Zeiten.	1
Toller Film mit reichlich Spannung und überraschenden Wendungen, hätte mich gefreut wenn er noch länger gewesen wäre, einige Situationen hätte man Ausgiebiger behandeln können, wirkt mitunter ein wenig abrupt der Wechsel, was in sich selbst aber auch wieder passt, je nach Blickwinkel.	1
Ich habe hier so manches gelesen, was mich fast vom Kauf abgehalten hätte.	1
Deswegen statt 2* jetzt 4*.	0
F&uuml;r 5 Sterne fehlt der Sekundenstopp, eine etwas l&auml;ngere Gangreserve und eine pr&auml;zisere Genauigkeit.	1
Nur eine kleine Stelle, die aussah, als hätte ich einen Fingertapser auf der Folie hinterlassen.	1
Alternative wäre nur der Kauf von einem  reinen Arbeitsmonitor und ein zusätzlicher Gaming Monitor gewesen.	1
Und weil das so ist, stirbt er nicht für mich. Er ist teil meines Lebens, wenn das auch ausstehende Menschen kaum nachvollziehen können.Es wäre eine pure Freude, wenn auch die anderen Alben mit einer Box gewürdigt werden könnten.	1
ICH sage nur: Spannend.Lustig..einfach der hamma wer staffel 1 und 2 gesehen hat darf nicht staffel 3 verpassen weil es wird noch besser	0
Die Kabellänge der vier USB hätte wirklich etwas länger ausfallen können, grade wenn der Rechner unter dem Tisch und das Laptop auf dem Tisch steht, kann aber leicht mittels USB Verlängerungskabeln gelöst werden.	1
Besonders den Song Winner könnte ich stundenlang hören, aber auch Hold on und Invisible sind überzeugend.	1
Wäre das nicht der Fall, würde ich es langweilig finden.	1
Ich hatte immer befürchtet, mir Batteriegriff wäre mir die Kamera zu groß und schwer (habe sehr kleine Hände) - überraschenderweise ist das nicht der Fall, der Griff fällt gewichtsmäßig nicht auf.	1
So wäre die Baugröße zwar etwas größer geworden aber nun hängt da noch ein weiteres externes Netzteil an der Steckdosenleiste.	1
Zum Film selber ist vor allem zu sagen, daß wir hier, da der Film von der Disney Company selbst stammt, wohl ein Märchen sehen, aber so schön und bezaubernd gemacht, das man nur sagen kann: Wenn es nicht wahr ist, so ist es doch wenigstens gut erfunden.	1
dann hätte ich die auch gegeben.	1
Mit dem nächsten Album müssen sie back to the roots, sonst ist diese Band für mich geschichte	0
Ich glaube der KVM-Switch von Aten ist einer der wenigen oder sogar der einzige Umschalter, der zwei USB-Anschlüsse statt der veralteten PS/2-Anschlüsse bietet.	0
Wenn ein Buch riechen könnte, dann würde dieses Buch stinken und miefen: Nach alter Uniform und ungepflegtem altem Mann mit fettigen Haaren.	1
Dialoge sind ok, Action hätte etwas mehr sein können.	1
Update: Ich habe heute das Glas erneuert, es hatten sich leichte Kratzer gebildet, nun könnte man vielleicht meckern nach nem halben Jahr, aber mein Telefon ist auch immer am Mann und hat auch schon mal ne Ladung Sand und Erde abbekommen, dafür gingen die Kratzer in Ordnung (sind auch nur aus bestimmten Winkeln so deutlich sichtbar).	1
Aber der AKG K44 ist nur nahezu perfekt, wäre da nicht der Tragekomfort.	1
Einen Lock-Schalter, den ich bei meinem Tamron 24-70 eigentlich nie benutze, vermisse ich hier sehr!.	0
Für einen Technik-Freak wäre das sicherlich alles kein Problem.	1
Funktioniert problemlos, außer mein G3 ist in nem Folio Case.	0
Dem Buch wären viele LeserInnen zu wünschen, man kann nur hoffen, dass es ein deutscher Verlag entdeckt.	1
Hätte man sicher technisch mit einer Klappe am Handgriff lösen können.	1
Ohne zuviel vorwegnehmen zu wollen, wäre das Ende meiner Meinung nach jedoch besser gelungen, wenn der Komplize des Attentäters nicht wie ein Mitläufer rübergekommen wäre.	1
Aber hier sieht es einfach danach aus, als wenn es nicht die Zeit für die Reifung und die Fertigstellung des Gesamten gegeben hätte.	1
Auch die aktuellen Nexus Geräte setzen statt Pogo-Pins auf Induktionsladung, die noch eleganter und komfortabler ist.	0
Ich vermisse Kelly Groucutt als Backgroundsänger, Bev Bevan am Schlagzeug, Mik Kaminski an der Violine und die satten Streicher im Hintergrund (echte Streicher..nicht die aus dem Computer).	0
"""Den saublöden Spruch \\""""Das weltweite Horrorphänomen mit über 23 Millionen Klicks auf Youtube\\"""" hätte man sich besser gespart."""	1
Kein spiel bringt sie in die Knie (außer beim Oversamplen).	0
Das Kabel und das Netzteil waren NICHT im Lieferumfang enthalten, müssen es aber auch offenbar nicht sein.	1
Vielleicht könnte man sich wünschen, das sie wsserfest sein sollte.	1
Mein Mann dachte zunächst, dass Horn könnte abbrechen, aber nein, es hält natürlich und unsere Tochter war begeistert!!	1
Auch hier lässt das &#34;Service Design&#34; zu Wünschen übrig.	1
Hätte die volle Punktzahl bekommen, leider hat die Metro nur zwei Tage lang funktioniert, hätte von Brio was anderes erwartet.	1
Das Armband könnte ein wenig wertiger sein, da haben die Parnis Submariner ein schwereres und solideres Band.	1
(aber wieder OK für den Preis)    FAZIT: Wäre das Piepsen nicht, würde ich für den Preis glatte 5 Sterne geben, aber weil es auf die Dauer wirklich nervig ist gibts nur 3.	1
ANSONSTEN sehr FETT , aber leider nur 4 statt 5 Sternen  \./,	1
Damit hatte ich eigentlich nicht gerechnet.	1
Wenn ich auch nur einen Stern abziehen hätte müssen währe der MB-D12 sofort zurück geschickt worden.Ich bewerte allerdings das Produkt und nicht den Preis darum 5 Sterne.	1
In meinen Augen ein Song, den ich Linkin Park nie zugeordnet hätte, wenn man mir die Augen verbunden hätte und mir das Lied gezeigt hätte.	1
Wenn ich diese DVD anschaue, fühle ich mich, als wäre ich mit dabei.	1
hätte die Schutzhülle perfekt gemacht.	1
Einziger Kritikpunkt wäre die angegebene Bauhöhe.	1
Armband könnte etwas weicher sein (ist Kunststoff, kein Kautschuk).	1
Die Zeit hätte ich auch anders nutzen können.	1
Na ja..ganz nett aber sonst..hätte man echt mehr raus machen können!.	1
Leider fehlt auch die Pointe.	0
Die CD kann man ganz gut im Garten (wenn es mal schön draußen ist) beim relaxen im Hintergrund hören.	1
So finden sich insgesamt 3 Nummern, die Herr Kasparek früher vielleicht mal als B-Seite verbraten hätte, der Rest ist eigentlich unter dem Banner RW als Frechheit zu bezeichnen.	1
Außerdem fehlt ein Stativ Gewinde.	0
Da hab ich mich von &#34;zertifiziert von Apple&#34; fehlleiten lassen und hätte besser die anderen Rezensionen lesen sollen.	1
Sie ist gut verarbeitet, aber bei dem Preis hätte ich schon liber echtes Leder.	1
Hätte ich das vorher gewusst,hätte ich mir nicht gleich 3 bestellen müssen :-)	1
Hier wäre eine feste Schlaufe, meinetwegen aus einer Art breitem Hosengummi, wertvoll, die auf beiden Seiten vernäht ist.	1
Für aktion oder sportfotografie wäre das objektiv sowieso aufgrund der brennweite eher ungeeignet.	1
Der Film gefällt, aber dass am Ende der Ton fehlt und anstatt der eventuell wichtigen Kommentare man nur ein nervigen Fehlerton hört ich doch sehr ernüchternd.. Habe es via TV, Laptop und Fire-Stick probiert, immer der selbe Fehler.	0
"""Songs wie \\""""Government Hooker\\"""" oder \\""""Scheiße\\"""" müssen mehrmals gehört werden bevor sich eine eingängige Melodie heraushören will."""	0
Das Plastikgehäuse fühlt sich an als ob es jeden Moment auch abbrechen könnte.	1
Hätte ich nicht im Ansatz gedacht.	1
In Nebenrollen trifft man einige alte Bekannte aus frueheren Buechern, die in die Jahre gekommen sind (Logan ist nur fast 'lammfromm', Chivers, Costa und seine Soeldner, ..), aber der Schwerpunkt der Handlung liegt auf anderen (ein Rechtsanwalt als Anti-Held, sein Name 'Temple' kommt wohl auch daher, weil er immer 'oh god' seufzt, wenn es brenzlig wird).	0
Es müssen hier die maximalen 5 Punkte vergeben werden.	0
Das Oberfach könnte noch ein bisschen Größer sein.	1
"""Mir fehlt der Schwung von \\""""What it is\\"""" oder \\""""Why are man\\"""" \\""""Speedway to Nazarrth\\"""" und die Intensität seines Gittarenspiels."""	0
Ich vermisse nur die M&ouml;glichkeit den Status der Verbindung am iPad zu &uuml;berpr&uuml;fen.	0
Auch hätte ich mir einen Boden aus Plastik gewünscht - erstens, damit der Rucksack selbstständig stehen kann (er kippt bei mir grunsätzlich nach vorn über) und zweitens, damit er nicht nass wird, sollte man ihn mal in einer feuchten Wiese abstellen.	1
Sie ist zwar etwas dick, so dass sie nicht unter jeden Hemdsärmel passt, aber das ist soweit ok. Das mit der Beleuchtung kann ich bestätigen, hier hätte man sicher mehr investieren können, um die Zeiger abzulesen reicht es gerade so.	1
Die CD läuft jeden Tag, zum Leidwesen meines Partners :-) Leider war die CD nicht Original verpackt (eingeschweißt), sehr schade, hätte also nicht verschenkt werden können!!!!!	1
Auch bei diesem Produkt zeigt sich mal wieder, wenn es von Apple ein Produkt gibt, dann funktioniert es einfach.	0
Dieses führt zu einem Punkteabzug, Mit geschwitzten Händen lässt sich das Rad nicht vernünftig drehen :(  Hier wäre ein hartes und geriffeltes Rädchen weit funktioneller.	1
Natürlich gefällt mir die CD sonst hätte ich sie ja nicht gekauft!	1
Album IWOA:  Der Sound ist durchgehen auf mittleren bis hohen Niveau, eine bessere Abmischung zur Neuauflage hätte der CD gut getan.	1
Aber wenn es passt, sollte man wirklich viel Freude an der Maus haben dürfen.	0
Wenn es das auch bleibt-perfekt :) Auch die anderen Schlüssel und Anhänger am Schlüsselbund und der tägliche Transport in Jacken- oder Hosentasche konnten dem NomadKey bis jetzt nicht viel anhaben.	1
"""Leider fehlt es aber diesem Gerät an \\""""Durchhaltevermögen\\"""" hinsichtlich der Akkulaufzeit."""	0
"""Der Spanngriff ist stabil und hat einen guten \\""""Druckpunkt\\"""", und wird nicht abbrechen wenn man mal fester dran zieht."""	0
Das ganze Teil wirk ein wenig instabil,man hat Angst es könnte brechen.	1
Menschen der unterschiedlichsten Herkunft müssen irgendwie miteinander klar kommen.	0
Einfach nur schlecht dieser Film.....das hätte ich von Will Smith nicht erwartet das er so einen schlechten Film dreht..Schade sage ich nur.	1
Mein Sohn ist begeistert vom Klingelton und der Leuchtanzeige, jedoch ist die Bedienung recht unfreundlich f&uuml;r Kinder, deshalb braucht er immer meine Hilfe und wenn es vergessen wird klingelt der Wecker auch Sonntags um sechs in der fr&uuml;h. :o((	0
bezahlen, wenn dies nicht der Fall wäre.	1
Qualität ist top (wäre sogar 5 Sternchen wert)..aber der Preis trübt den ansonsten hervorragenden Eindruck ein wenig, daher nur vier Sternchen.	1
wenn ich zehn Sterne geben könnte würde ich es tun.	1
Die Geschicht könnte auf jeden Planeten in jedem Universum spielen.	1
in diesem Buch wird nicht nur die Thematik der Slideerstellung sondern auch das Präsentieren selbst behandelt.	0
Ich habe ihn sogar ohne Lüfter verbaut, CPU wird nicht heißer als 62°C, das ist OK.	0
Der Ständer ist die neue Variante auf den die Puppe &#34;gestellt&#34; wird statt &#34;drangeklickt&#34;.	0
Verstehe ich nicht, dachte der Zigarettenanzünder wäre weltweit gleich?!?!	1
Wie immer qualität wie von lego gewohnt ,könnte für den preis ein wenig größer sein ,war schnell und mit spaß aufgebaut, gut	1
Ich habe manches Mal nach der Kamera suchen müssen, was Zeit und Luft gekostet hat.	0
Trotzdem tut was es soll und das in sehr guter Qualität auch wenn es bei mir weiterhin ein leichtes Rauschen gibt.	1
Jedenfalls sind Verarbeitung und Farben sehr gut, ich könnte nicht zufriedener sein.	1
Der Klang der Vinyl lässt dazu noch stark zu wünschen übrig.	0
Da wäre mir ein Buch (wie gehabt zu 99 Cent für einen Tag, z.B.)	1
Die Verpackung könnte besser sein.	1
Unsagbar toller Film mit einer tollen Geschichte, grandiosen Schauspielern und ein Ende, mit dem man nicht unbedingt rechnet, auch wenn man es ahnen könnte.	1
Meine vorhandenen Karten haben nicht das &#34;+&#34;- Zeichen.	0
aus der story hätte man wesentlich mehr machen können.	1
Warum mehr bezahlen wenn es auf Amazon billiger geht.	0
Schön wäre noch, aber vom Preis her wohl nicht machbar, wenn man einen Zeitraum einstellen könnte, in dem die Kamera aufnimmt (z.	1
Zwar wäre die HDD als Systemlaufwerk wohl den meisten zu langsam, aber als Datengrad kann ich sie nur empfehlen!	1
Es ist ein moderner Klassiker und eine sehr gut verarbeitete Uhr (und ich bin wirklich genau wenn es darum geht zu entscheiden ob etwas billig oder gut verarbeitet wirkt).	0
Sie hat Angst davor, dass jemand ihr Elend sehen könnte und ihr zu nahe kommt.	1
Da hätte man viel viel viel mehr daraus machen können.	1
Würde meine Tochter das Haus trotz der miserablen Qualität und des schlechten Preis- Leistungsverhältnisses nicht so sehr lieben, hätte ich es zurückgesendet!.	1
Für diese Widersprüche und auch Sackgassen eines in den Trümmern Deutschlands vereinsamten Postwagnerianers fehlt Jessye Norman der Sinn.	0
Ich verstehe und respektiere, dass sich Mrs. Harris beim Schreiben ihrer Buchreihe nicht den Wünschen der großen Fangemeinde beugen will, aber ich finde, sie hätte sich wirklich die Mühe machen können, die Serie trotzdem mit einem „Knall“ zu Ende gehen zu lassen.	1
Zumindest ein Hinweis das es NICHT dabei ist und welcher Artikel passt wäre fein.	1
Die haptische Qualität scheint gut zu sein, nur können wir es leider nicht verwenden, wäre nett wenn es einen Umtausch geben würde.	1
Allerdings wäre es praktischer, wenn man einen &#34;Deckel&#34; zum zumachen hätte.	1
Eine Wirklich gute maus, einziges manko was aber eigentlich nicht stört ist dass man die treiber extra Von der Hersteller HP laden muss.	0
.. das bequeme Schulterpolster könnte etwas fester auf dem Gurt sitzen.	1
falls es Probleme mit 2 Tastaturen geben könnte.	1
Diese harte Trennung der beiden Bevölkerungen wird in gemeinsamer Bürogebäuden aber vollkommen außer Acht gelassen: Selbst Neuzugänge werden direkt in genau den Stock geschickt, in dem die &#34;Oberen&#34; an der Decke der &#34;Unteren&#34; herumwatscheln.	0
Wenn diese in den Einstellungen auf goodnotes statt auf Adonit also auf die Handballenerkennung der App statt auf die des Stiftes umstellt ist das Ding der Wahnsinn.	1
Was ich allerdings vermisse ist, dass man KEINE DPI Abstufungen einstellen kann.	0
Außerdem hätte der Hersteller bei diesem Preis durchaus eine preiswerte Hülle mitliefern können.	1
Ich könnte so weitermachen und jedem Song hochloben doch dies soll der Hörer dann doch selbst machen indem er dieses Album schnellstens käuft.	1
Die Serie ist super,allerdings würde ich sie gerne komplett verstehen und nicht immer zwischen Deutschen und Englischen Folgen wechseln müssen.	1
Das wäre ein sehr ehrgeiziges Single-Release, aber cool für den Sommer.	1
Günstiger wäre es gewesen den Platz für die Schlaufen wechseln zu können, indem man sie in Griffnähe alternativ anbringen könnte.	1
Der denzel hat es einfach knallhart drauf.er ist geschaffen für diese Rolle und ich könnte mir keinen anderen dafür vorstellen.	1
Als meine Tochter sich ein Barbiehaus wünschte habe ich mich auf die Suche begeben und natürlich zunächst Preise verglichen.	0
Das Einsetzen der Halteplatte, die auf der Rückseite des Mainboards durch die 4 vorgesehenen Löcher gesteckt wird könnte ein Problem sein, wenn man ein billiges PCGehäuse hat und die Rückseite nicht zugänglich ist.	1
Zubehör ist leider keins dabei außer Treiber / Software und ein DVI / VGA-Adapter - also auch kein 6-Pin-Stromstecker (einer wird benötigt).	0
Wenn man den Kindle damit noch hinstellen könnte, bekäme es 5 Sterne	1
"""Mit einem neuen Team soll er für den japanischen Geschäftsmann Saito eine sogenannte Inception durchführen, statt eines Gedanken zu \\""""extrahieren\\"""", soll er nun eingepflanzt werden."""	1
Allerdings hätte ich mir eine literarisch bessere Behandlung des Themas gewünscht!	1
Hier und da hätte man aber mehr draus machen können, daher 4 Sterne.	1
Der rote Faden fehlt aber.	0
Klar, wer die Verpackung genau liest stellt fest, es steht ja drauf, aber daß sich die 60 Teile auf die einzelnen Papiere und sogar auf die 8 Gummiringe bezieht, hätte ich nicht gedacht.	1
'tootsie' ist ein Klassiker, den ich stundenlang in Dauerwiederholung sehen könnte.	1
Hätte mir besser davon noch ein paar zugelegt ..    Den zweiten von zwei Sternen Abzug gibt es fairerweise erst dann, wenn ich  auf Datenverluste stoßen sollte.	1
Das Oberkleid wirkt haptisch wie aus Krepppapier, der Unterrock, als wäre er aus Omas Unterhose zusammengeschustert- irgendwo zwischen Tsingtao und Wladiwostok.	1
Wenn der Preis für so ein Stück Kunststoff deutlich niedriger wäre, gäbe es auch volle fünf Sterne.	1
Gut, das wäre geschafft.	0
Bei einem originalen Zubehörteil hätte ich mich schon über einen abgewinkelten Stecker gefreut.	1
Nachteil ( könnte an meinen pc liegen) ist es das der usb stick nicht immer vom pc  erkannt wird.	1
Ich selbst hätte gerne mehrere Modis eingestellt da ich nicht nur Zocke sondern auch Programmiere und Surfe.	1
7 Wörter müssen noch geschrieben werden:.	0
definitiv ein MUSS, wenn man auf alles rund um das Thema &#34;Samurai&#34; steht auch wenn es hier ein Stück zu weit ins Fantasy Genre geht ;) Aber sonst sehr sehenswert ..	1
Für den günstigen Preis eine gute kleine Automatik.Das Gehäuse könnte flacher sein, aber das Uhrwerk erfordert die Höhe.	1
Da der ADJS diese empfindliche Spitze hat, wäre eine Schutzhülle hierfür oder eine Kappe, die man aufsetzen könnte wünschenswert.	1
Sie sind Gut verarbeitet und ich kann eigentlich nicht mehr dazu schreiben als eine Kaufempfehlung	0
Die Ablagetasche könnte etwas höher und breiter sein, da die Dinge in der Tasche zu weit rausgucken und sie etwas zu klein ist.	1
Natürlich taugt der Film als einigermaßen gute Abendunterhaltung, gemessen am &#34;Hernn der Ringe&#34; ist er aber so enttäuschend, dass man schon nach kurzer Zeit eigentlich nicht mehr hinschauen mag und sich ängstlich fragt, ob der dritte Teil noch tiefer sinken kann, bzw.	0
könnte 1mm größer sein um -perfekt- zu passen (Nex 5n).	1
Bei einer Kamera in der Preisklasse müsste so ein Griff dabei sein, und der Preis für so ein Stück Gummi ist auch grenzwertig..	1
ein wenig mehr Wärmeleitpaste könnte dabei sein aber wenn man sparsam damit umgeht reicht es so grade mal.	1
Das zweite und wichtigste es passt nicht so ganz mit meinem mainboard, zwar geht es rein Schrauben passen auch doch wenn ich meine Grafikkarte reintue dann fehlt 1-2 mm zur Rückwand zwar bekommt man die Karte mit Not dran doch das ist schon sehr merkwürdig.	0
Für die Stativbefestigung größerer Stative fehlt unten ein zweiter Haltegurt.	0
Nach jedem Band war ich so ver&auml;rgert &uuml;ber diese Punkte, das sich eigentlich nicht weiterlesen wollte.	0
B. Öffnungen, wo man Teile reinwerfen könnte oder Puzzles, Knöpfe, usw.	1
Statt selbst verliebt wie manch andere Frontmänner seinen Egostreifen durchzuziehen, die Erkenntnis das zusätzliche Chorus-Vocals durchaus bereichernd sein können.	1
Und schon deshalb könnte ich die CD den ganzen Tag hören :-).	1
Das MMI zeigt die Meldung: Kabeltyp wird nicht unterstützt	0
"""Ich hätte vlt 5 Sterne gegeben, wenn sie \\""""ihrem Stil treu\\"""" geblieben wären."""	1
Alle anderen Alben müssen sich also an dieser Scheibe messen.	0
Ich weiss nicht ob Sony die Kamera die sie bauchen auch mal vor Auslieferung in der &#34;Hand&#34; testen, Scheins nicht sonst müsste man diese Gimmick nicht dazu kaufen.	1
Und die Speicherkarte verschwindet bis auf 12 Millimeter im USB-Stecker des Autoradios, noch kleiner und man könnte es mit den Fingern nicht mehr herausziehen.	1
das Gehäuse hat aber die selben Probleme wie die ersten original gopr ES BRICHT BEI BELASTUNG deshalb bitte nicht auf dem KITE board benutzen, Habe das gerät jetzt auch schon 3 mal gekauft und hätte wohl doch besser zum original gegriffen.	1
Live Over Europe 2007 ist aber dennoch ein gutes Live Album, auch wenn es kaum Live-Atmosphäre aufkommen lässt.	1
Medium wird nicht erkannt o.ä.)	0
Schade, dass sie schon so früh gegangen ist, hätte bestimmt noch viele super Alben gemacht.	1
