sentence	is_counterfactual
Die Rettung des Gigs ist wohl John Paul Jones und Bonham Jr. zuzuschreiben, diese stabile Bass/Drum Gruppe hämmert Page und Plant durch den Abend  als wäre Bonzo noch am Leben - und es ist auch gut so !.	0
Aber wie gesagt es fehlt so ein wenig was vom ganzen, so dass am Ende mehr Fragen bleiben, als Antworten gegeben wurden.	0
Als wenn es nur noch die Game-Zocker-Nerds Generation als Zielgruppe gäbe!	1
Wie bei den meisten Kopfh&ouml;rern gehen diese immer wegen Kabelbruchs ( Wackelkontakt, meist fehlt dann ein Kanal)kaputt.	0
Das Gerät arbeitet super wäre schön wenn eine deutsche Betriebsanleitung dabei wäre.	1
Zu anderen Geräten kann ich nichts sagen, dass ist mein erster Droide, sonst nur Apple im Hause, wo die NFC-Unterstützung ja derzeit noch fehlt.	0
hab gesucht und gefunden schon der 2. gerät hatte gedacht hätte meins verloren.	0
Was mir ebenfalls sehr gefällt, die zentrale Klemmschraube wird nicht in ein Gewinde im Halterselbst geschraubt, sondern ist eine durchgehende Schraube und wird in ein Gewinde am Knebel geschraubt.	0
Stellt man die Einstellungen etwas niedrigen müsste es aber ruckelfrei laufen.	1
Der Film ist zu gut bewertet..hätte mir mehr davon erwartet..tolle Hauptdarsteller, aber die Storry war nicht meins.	1
Die zu bauenden Teile sind ehrlich gesagt eher lächerlich, zumal die Konstruktionen durch mitgelieferte Papierschnippel zusammengehalten werden müssen.	0
Wäre sie nicht dabei, würde wirklich etwas fehlen!	1
Es ist stabil verarbeitet, bei den Attacken meines Sohnes wird mir nichts geschenkt und außer ein paar leichte Kratzer an der &#34;Klinge&#34; ist nichts zu sehen.	0
der Sterneabzug ist lediglich für meinen Eindruck, dass der Sitz mittels Klettverschlussband am Blitzgehäuse besser sein könnte.	1
Ich hätte vom Hersteller besseres  erwartet und bin enttäuscht.	1
White, kann man deutliche Unterschiede zu den Stereo Mixen hören, ohne mit dem Hörrohr vor den Boxen sitzen zu müssen.	0
Hab den Akku nach ein paar Wochen wieder tauschen müssen, da es sich sicherlich nicht um ein Original handelt!.	0
Würde man den Stick neu formatieren, wäre er wieder ca.	1
Wenn der Preis nicht so unverschämt hoch wäre, hätte es volle 5 Sterne gegeben.	1
Ist schon ein großer Brocken - und man muss mit RAM Riegeln aufpassen dass die noch reinpassen - sprich gehen nur welche ohne Kühlkörper außer man montiert den Lüfter falschrum (ansaugend statt die Luft durchzublasen)	0
Right Now 10/10 könnte sie als 2.	1
Funktionieren wäre zuviel gesagt, den die Karte muss des öfteren deinstalliert und erneut installiert werden, damit sie vom System erkannt wird.	1
von Nightwish einfach nicht ran, da jegliche eingängige Melodie fehlt.	0
Nichts desto trotz ist Get Lucky eine tolle CD die man einfach haben sollte, auch wenn sie etwas fetziger sein könnte.	1
Auch wenn sie größer wäre, würde ich sie an Amazon zurückschicken, da sie so was von laut tickt, dass man sich an nichts anderes mehr konzentrieren kann.	1
Klang:  Von der CD1 mit dem remastered Album hätte ich mir eigentlich eine deutlichere Klangsteigerung erwartet.	1
Wenn es nicht so umständlich wäre den Kühler zu tauschen würde ich la mal einen anderen probieren.	1
Sterne ziehe ich hierfür nicht ab, da es mit der Performance der Karte nichts zu tun hat, hätte aber von Asus mehr erwartet.	1
Ich hätte mir lieber gewünscht, dass hier ein emotionaler Konflikt entstanden wäre, dann wäre es auch garantiert ergreifender geworden und die Gefühle wären besser transportiert worden (und dadurch hätte auch mein folgender Kritikpunkt vermieden werden können).	1
Hätte nicht gedacht dass die Kombination von Soundkarte + Boxen so wichtig ist.	1
Zwar trägt man sich manchmal, ob es einer der deutlich günstigeren Griffe nicht auch getan hätte.	0
Ich habe mir statt des unendlich teuren Original Alubügels von Panasonic diese Griffbefestigung für meine GM 1 gekauft.	1
Leider hätte ein Deutscher für dieses Buch wahrscheinlich keinen Verleger gefunden.	1
Habe den Prozessor nun gut einem Monat laufen, er verichtet seine Arbeit tadelos, jedes Spiel läuft Butterweich, was vorher mit meinem alten Athlon x2 nicht Funktioniert hätte.	1
hätte eins/zwei Songs mehr haben können (40 Minuten Gesamtspieldauer).	1
Außerdem kann der Kleine die Aufkleber noch nicht selbst anbringen – da fehlt noch die ruhige Hand.	0
Wäre schön, wenn du noch Konzerte in Deutschland geben würdest!!	1
Hätte nie gedacht, dass ein guter Monitor so entlastend für die Augen sein kann.	1
Die sind ihm auf jeden Fall zu wünschen und ich freu mich auf neue Aufnahmen.	0
Sie liegt gut in der Hand, aber könnte noch ein bisschen mehr Grip haben.	1
Allerdings kostet das Stativ ohne Kopf alleine 120€ und hätte mit Kugelkopf mein Budget gesprengt.	1
Watchever wäre zum Beispiel so ein Kandidat.	1
Hätte ich nicht gedacht!.	1
Der Motor könnte stärker sein und das Fahrzeug fährt nur sehr langsam.	1
Der Akku ist für 900mAh gut, schade das es für diese Kamera nicht einen effizienteren Akku gibt &#62;1000mAh das wäre zu Zeit eine echte Marktlücke.	1
Ich glaube dass sogar Olivenöl eine Verbesserung gebracht hätte.	1
Das Geld hätte man sich sparen können.	1
Nach umfangreichen Recherchen im Internet, welche Hülle nun auch für den größeren Akku passen könnte, war ich am Ende genau so schlau wie vorher.	1
Hat Spaß gemacht den zu gucken ;) (noch 8 Wörter müssen hinzugefügt werden, deswegen.	0
Kam zwar sehr schnell, aber es sah aus, als wäre das Dung hin und her geworfen und dannach unter was schwerem gelagert worden	1
Es geht mehr um „was wäre wenn“ und das gefällt mir äußerst gut.	0
Wenn es gefällt, dann lohnt sich auch das Buch.	1
Er zeigt aber auch, dass Kinder aus vernachlässigten Elternhäusern nur dann eine faire Chance auf einen guten Start ins Leben haben, wenn es spezielle Förderprogramme für sie gibt.	1
Volle 5 Sterne und hätte ich mehr wurde ich auch 8 Sterne geben.	1
Habe aber die Befürchtung, dass dieses Spielzeug dann uninteressant werden könnte.	1
Ansonsten entwickelt sich die Story teils langsamer, als dies sein müsste.	1
Verarbeitung wirkt solide (es wird nicht nur Kunststoff verwendet) und die platzsparende Aufbewahrung ist auch von Vorteil (falls man nicht nur zuhause rumsitzt).	0
(Chip und Software müssen zusammen passen).	0
Zudem ist nach einigen Wochen des Gebrauchs eine Kante abgebrochen (unten links), was ich mir bis heute nicht erklären kann, da ein Schutzcase über die Glaskante hinausragt und somit gar nichts an die Ecke des Anker-Protectors drankommen könnte.	1
Es wäre aber gut, zumindest &#34;mal einen Blick aufs Handy&#34; werfen zu können, auch wenn es gerade lädt.	1
Den Film hätte man auch in 1,5 Stunden abdrehen können.	1
Die Serie ansich hätte 5 Sterne verdient wenn man sie so schauen könnte wie man wollte..	1
"""Hätte irgendwer vermutet, dass Kelly Clarkson eines Tages Lieder mit Titeln wie Judas\\"""" oder Sober\\"""" singt und sich dabei irgendwo zwischen Pop, Alternative und Rock bewegt?"""	1
hundert Euro und kann ihn gar nicht liefern (wenn jemand so dämlich wäre, ihn denn wie angeboten dort auch zu ordern).	1
Und dann wäre da noch einfach der Spaß, den es macht, diesen Film zu gucken!	1
Auf den letz­ten Sei­ten pas­sierte plötz­lich alles auf ein­mal und an Erklä­run­gen wurde rapide gespart, sodass ich mit einem unbe­frie­dig­ten Gefühl zurück gelas­sen wurde, da ich gerne noch ein paar Ant­wor­ten auf meine Fra­gen bekom­men hätte.	1
Das hätte man etwas abgesetzter gestalten können.	1
Hier wäre es angebracht gewesen, auf die Unterteilung nach Buchstaben zu verzichten (meiner Freundin habe ich den Tipp gegeben, die Raster einfach abzuschneiden und das chronologisch zu nutzen).	1
Die Aussparungen für das Dia sind nur 36mm breit, weswegen man mit 36mm geöffneten Rähmchen statt der ganzen Breite den Rand dahinter sieht.	0
Der Download ist aber von der Klangqualität trotz der 320kb/s sehr schlecht und hier fehlt es an jeglichen Details.	0
So werde ich diesen voraussichtlich reklamieren müssen und hoffe,dass es irgendwann einen aus Metall geben wird.	1
Hätte ich die Synopsis bei IMDB nicht vorher gelesen, hätte ich nicht sehr viel vom Film verstanden.	1
Bin froh das ich ihn nicht im Kino gesehen habe, da wäre ich etwas enttäuscht gewesen.	1
HAbe zwar eine Weile auf diese CD warten müssen aber sie ist einfach spitze so wie auch der Film den ich gesehen haben.	0
Dann könnte alles schön beinander ins Gepäck :( Ich gebe trotzdem fünf Punkte.	1
Umso erstaunter war ich die neue Nightwish Single Eva zu hören, da war irgendwie nichts wie früher und man konnte nicht unterscheiden ob das nun Nightwish oder Withi**** Temp**** sind :-)    Mit Amaranth konnte man jedoch schon hören, dass auch der alte Stiel vorhanden war, doch auch hier war es nicht wie früher.	1
Der Film zeigt, was die meisten Kinder sich wünschen.	0
Das Schulterpolster würde ich mir mit einer rutschfesten Unterseite wünschen - so geht es bei jeder Bewegung auf Wanderschaft und sitzt nicht auf der Schulter.	1
(Ich vermisse immer noch meine Microsoft Sidewinder Maus der letzten Serie, die war klasse).	0
Die 250er wäre nur noch mit Stativ machbar.	1
BOAH ich könnte jedes mal irgendetwas gegen den TV werfen wenn ich die sehe (hässlich, dumm, egoistisch, hässlich, dumm und hab ich schon hässlich gesagt ?)	1
Einziger, wenn auch kleiner Wehrmutstropfen: der Druckpunkt könnte spürbarer sein.	1
… es müsste schärfere Bilder zeichnen.	1
Endlich dürfen wir sie hören.	0
Mir fehlt in dem Film nichts.	0
Das empfinde ich als einen großen Mangel und ich würde mich wünschen, dass man das ändert und die Erweiterung auf altem Material gedruckt wird.	1
Das wäre aber zu schön um wahr zu sein.	1
"""Das einzige Manko: \\""""Tage wie dieser\\"""" fehlt."""	0
Die Lasche ist auch direkt rechts und links angenäht, ohne Luft für den Griff des Koffers zu lassen - der Spielraum müsste also vom nicht prall gefüllten Rucksack kommen.	1
Ich möchte jedenfalls diese Zeit vor 70 Jahren nicht mehr erleben, schon gar nicht mit der Weltanschauung des Protagonisten mich im täglichen Leben auseinander setzten zu müssen.	0
Das ganze Buch straffer und in besserer Sprache erzählt hätte von mir 4 Sterne erhalten.	1
Zum Glück gibt es aber weniger von den Bon Jovi ähnlichen &#34;Schlager-Alle-dürfen-mitsingen&#34; Passagen wie auf der AB III.	0
Die &#34;Gegenlichtblende&#34; (müsste ja eigentlich Streulichtblende heißen) erfüllt ihren Zweck.	1
optisch ok aber funktioniert nur ordenlich auf mausunterlage,ohne auf glattem schreibtisch nur schlecht.kabel sehr steif dadurch maus trotz gewichte dafür zu leicht.wenn ich nicht unbedingt eine maus bräuchte hätte ich sie zurück geschickt	1
Beim der Auswahl zum Kopieren ist es jedoch nicht möglich mehrere Objekte (oder gar alle in einem Ordner) auswählen sondern nur einzelne - was für meinen Zweck kein Problem ist, da ich von der SD-Karte einfach den ganzen Ordner mit den RAW-Dateien auswähle und kopiere, jedoch vielleicht für andere Anwendungswünsche problematisch sein könnte.	1
Was ich mir wünsche würde, wäre ein zusätzlicher Linsenschutz, der in der Halterung aufgesetzt werden kann.	1
Aber muss man eigentlich OV schauen, sonst fehlt das typisch britische ;-)	1
Fazit da wo man es brauchen könnte gehts nicht, da wo es geht gehts ohne besser!	1
Zum Surround-Mix kann ich leider nichts sagen, da mir bislang noch das Equipment fehlt.. Irgendwann denn.	0
Ich hätte nicht erwartet das ein so günstiges Gerät so viel Lauschfreuden bereiten kann.	1
Könnte er das, wäre das Teil Perfekt, denn die Wiedergabe  der Angebote ist super.	1
Wenn es noch als MP3 Bedienfeld taugt dann gibt es den 5ten Stern noch dazu.	1
Schade - daraus hätte man mehr machen können..	1
Jetzt wünschte ich mir ich hätte ihn nie gelesen.	1
Ich nutze das Teil ungern, nur wenn es gar nicht anders geht (SD-Karte ohne Rechner mit Slot kopieren) vermeide es aber.	0
Ich bin sehr zufrieden, wenn es immer so läuft wäre es klasse.	1
Das einzige was ich gerne gehabt hätte, wäre ein kleineres Modul (ähnlich wie der GP-E1 von Canon), da der GP-E2 etwas zu groß ist, um ihn auch regelmäßig aufzusetzen.	1
Wenn es der Band gelingen sollte ( und daran habe ich wenig Zweifel ) , ihren bereits auf &quot;fallen&quot; gefundenen Stil zu verfeinern und zu verbessern, dann sollten wir uns auf etwas Großes gefasst machen.	1
Anfangs benötigte der Film ein wenig Zeit bis er in die Gänge kommt, wenn es dann aber losgeht mit dem &#34;Leben - Sterben - und von Vorne&#34; ein riesen Spaß für die männlichen Zuschauer.	1
Die Aufnahmetechnik lässt zumindest bei meiner Anlage einiges zu wünschen übrig, ohne dass es sehr wahrscheinlich sei, dass der &#34;verhaltene&#34; Klang an der Anlage läge, denn die gesamte Anlage ist eine &#34;Burmester-Edel HIFI&#34; und gehört zu den besten, die man in dem Sektor bekommen kann.	1
Dieses Apple-Konzept ist das beste Beispiel für die mangelnde Funktionsfähigkeit des Kapitalismus, wonach der Markt immer die besten Lösungen hervorbringt: Dann hätte sich hier nix geändert.. .	0
Zugegeben, der Preis ist schon etwas hoch, aber ich habe versucht das ganze mit Edelstahlplatten und entsprechenden Schrauben (Keine 6mm Schraube nehmen, wenn man sich nicht das Gewinde am Gehäuse versauen will) nachzubauen, und wäre dann nicht wesentlich billiger davongekommen.	1
Die Maus gefällt mir sehr gut, außer einem Punkt: dad Mausrad quitscht unangenehm beim vorwäts drehen, deswegen ein Punktabzug.	1
Leute die so eine Mariah nicht mehr hören wollen und sich wünschen dass sie wieder zu ihren Anfängen zurückkehrt sollen mir mit der Bewertung bitte folgen!	1
Es ist so, wie schon beschrieben wurde, dass jedes Dia ausgerichtet werden muss, was anderes wurde aber auch nicht erwartet und wäre akzeptabel.	1
Der einzige Pluspunkt ist die sehr gute Verarbeitung - wäre das Micro und der Sound auf dem gleichen Niveau.	1
Ich für meinen Teil finde sie durchaus gelungen, bis auf die Rückseite der Schwanzflosse, hier hätte eine gleiche Optik wie die Vorderseite durchaus Sinn gemacht.	1
Mehr Hintergrund zum Leben vor der Sklaverei wäre nicht schlecht.	1
Man könnte es auch Schwachsinnig nennen!.	1
Wenn doch alles im Leben so leicht und unkompliziert wäre!!	1
Das wäre bei Verwendung teurerer Materialien möglicherweise  nicht der Fall.	1
Das Resultat sieht immer so aus, als ob der Blitz leicht nach oben geneigt wäre.	1
Sonst hätte ich mich auch nicht dazu durchringen können knapp € 100 in diese Karte zu investieren.	1
Die Geschichte spielt zwar in einer erdachten Welt, könnte aber auch in &#34;unserem&#34; Mittelalter angesiedelt sein.	1
Hier hätte ich mir gewünscht, wenn zu jedem einzelnen Song die daran beteiligten Musiker angegeben wären.	1
Alles geht ohne Mühe vonstatten und ist für mich sehr viel besser als mit den Fingern arbeiten zu müssen.	0
Die Rahmenhandlung mit dem Roudie Trip hätte man sich wiederrum echt sparen können.	1
Für das sicherlich kommende zweite Album würde ich mir mehr Mut und Abwechslung wünschen.	1
Der sand ist super.war eigentlich für mein sohn gedacht..doch nun spielt der papa damit.werde wohl noch einen bestellen dürfen damit es kein streit gibt :D der sand lässt sich super formen und fließt auch sehr schön.	0
Wäre der Film auf 100 Minuten gekürzt, wär's der Knaller.	1
Ich war schon länger auf der Suche nach einem Kopfhörerhalter, die sind schwer zu bekommen und wenn es welche gab, dann nur die aus gebogenem Holz für knapp 100 euro!.	0
Und somit wäre es das letzte Maiden-Album bzw.	1
Vieleicht werden manche meinen es wäre zu klein.	0
laurie hätte in seinem booklet-text gar nicht so weit ausholen müssen,um seine roots verständlich zu.	1
Ich haben mir diese Uhr jetzt zum zweiten Mal gekauft, da die erste nach sechs Jahren ihren Geist aufgegeben hat, allerdings hat sie auch Extremsportarten und jede Menge Outdooraktivtäten mitmachen müssen.	0
Normalerweise ist es sehr selten, das ich Coverversionen den Originalen vorziehe, aber Yes schaffen es, den St&uuml;cken eine eigene Note zu verpassen, dass man glaubt, die Band habe die Songs selbst geschrieben, zudem f&uuml;gen Yes l&auml;ngere Einleitungssequenzen hinzu, was die Songs noch attraktiver macht.	0
Auch wenn es am Ende etwas unrealistisch wird, ist der Film sehr gut und nur zu empfehlen.	0
Auch optisch lässt sie nichts zu wünschen übrig.	0
Autofahren) von enormem Vorteil wäre.	1
Auch die Qualität lässt nichts zu wünschen übrig.	0
habe leider das Produkt nicht vorsichtig aufgemacht, ansonsten hätte ich es wieder zurück geschickt.	1
Zum Glück gibt es Amazon sonst hätte ich dieses Produkt nicht haben können da in Österreich nicht erhältlich.	1
Wenn es verwendet wird, ragt der Arm von der Seite auf den Tisch und er ist lang genug, um das Display seitlich zu montieren und das Display quer über den Tisch zu schwenken.	1
könnte ein bisschen schneller sein, und sollte ein wenig tiefer baggern.	1
Ich habs befürchtet, aber heute konnte ich den Film einen Euro ausleihen .. mit nem Ü-Ei wäre ich besser bedient gewesen.	1
Zuvor hatte ich mir einen Metz Blitz bestellt (der nach Info von Metz hätte funktionieren müssen, was er dann doch nicht hat), der war hochwertiger verarbeitet.	1
3 Sekunden und wäre akzeptabel, das Umschalten von Linux auf Windows dauert manchmal sogar über 30 Sekunden.	1
Auch wenn es nicht ganz die Qualität der allerbesten King-Romane erreicht, ein absolutes Muss!	1
Das Gehäuse mit der verbauten Lüftertechnik ist für eine CPU mit einer TDP von 65 Watt ausgelegt (Der i3 hat 55Watt), mit entsprechend stärker und lauter laufenden Lüftern könnte durchaus noch mehr Abwärme abführen.	1
Aber die Mühe lohnt sich, weil die Geschichte spannend ist und die beste Kritik ist, wenn es einem schwer fällt mit dem Lesen aufhören.	0
Trotz dieser konstanten Grundstimmung fehlt es natürlich nicht an Variation in Bezug auf die Charakteristik der Songs.	0
Spanglish ist kein Film, der gewollt auf Humor abzielt!.	0
Dafür hat sich West hier mal so richtig künsterlich austoben dürfen, um das Album zu machen, was er schon immer mal auf den Markt werfen wollte.	0
Zum Spielen habe ich sechs Tasten nach meinen Wünschen belegt.	0
die sie, wie keine andere intonieren könnte.	0
Keine gute Qualität für das Geld hätte gedacht das es beser ist aber Bilder sind schnell verblasst rate nur ab	1
Jetzt noch eine Docking station Finden wo was S2 incl der Otterbox reinpasst,  und Ich wäre mehr als Glücklich.	1
Die Hälfte wäre noch teuer genug!!!.	1
Auch wenn die Stimme von Bobby Kimball vielleicht nicht für eine Welt -Tournee ausreicht, ich hätte mir einen Split zwischen Joseph Williams und ihm gewünscht.	1
Die Protagonisten,sprich Darsteller verkommen teilweise zu schwachsinngen Idioten die einen Haufen Stuss reden.Scotty mit seinem merkwürdigen Begleiter (Krabbe oder was soll das sein),Chekov,ein stammelndes Männchen,Spock immer am Rand eines Nervenzusammenbruches und Kirk der pubertäre Kapitän,wunderbar.Gut ,in einem Land in dem Sendungen wir Big Brother gefallen,sollte ich mich eigentlich nicht wundern,das es doch viele gibt die so etwas toll finden.	0
Die warme Luft wird nicht nach außen abgeführt.	0
festen Sitzes in den meisten Situationen ausreichend ist) und die Klappe nur zu schließen, wenn es unbedingt nötig ist.	0
Ich glaube auch nicht, dass jemand bei größter Anstrengung (ohne Hilfsmittel) diese Klinge abbrechen könnte (5 mm stark).	1
Die Dockingstation hätte evtl etwas mehr Gewicht haben können, aber es geht noch beim aufladen.	1
Wie hier schon mehrfach geschrieben wurde wäre ein Kordelzug im unteren Bereich perfekt.	1
Ich wünschte ja selbst, ich könnte diesem Album mehr Sterne geben, aber es spricht mich einfach nicht an.	1
Ps: Schade, dass auf der LP Version wohl leider nur das Album- Cover OHNE Bandname zu sehen ist, sonst hätte ich mir die LP Version bestellt.	1
Ich hatte erst Sorge das es evtl kein original Akku wäre, aber es scheint alles in Ordnung.	1
Ich hätte auf die schlechten Bewertungen hören sollen!.	1
Nehmen Sie das niedrigste Angebot an, müssen Sie für das Risiko, das Sie eingehen, etwas hinzurechnen.	0
Volle 5 Sterne würde es geben wenn am Band ein Klipp wäre wie teilweise an Jacken oder so.	1
Wegen der Comics ist er teurer und - was ich in der Beschreibung völlig übersehen habe - ihm fehlt das Adressbuch.	0
Das Album an sich gefällt nicht nur, sondern könnte auch richtig Spaß machen.	1
Ansonsten ist der Film gut anzusehen, die Qualität könnte besser sein, deshalb 1 Stern weniger	1
Man hätte allerdings noch mehr daraus machen können (bzgl.	1
Es fehlt wieder die alte härte die sie mal hatten, alles ist wieder verweichlicht und nur auf.	0
Man könnte das endlos fortsetzen.	1
Es könnte zwar noch etwas Länger sein aber es passt so, kürzen ist noch möglich aber eben verlängern geht nicht mehr!!.	1
Der Deckel könnte für meinen Geschmack etwas stabiler und mehr in Form bleiben, aber ansonsten erfüllt die Box ihren Zweck gut und schaut bei weitem besser aus als eine Plastikbox.	1
(Auch wenn es einem ja schon durch die Realität bekannt war, was kommen wird..).	0
Grundsätzlich wäre ich aber sehr zufrieden mit der GTX 660.	1
Wenn hier jemand Empfehlungen aussprechen kann wäre ich dankbar.	1
Für reines Musikhören fehlt eventuell etwas Bass, mich stört das jedoch kaum.	0
Doch mir fehlt schon etwas die Creepy Maleficent.. Vom Screenplay und auch Handlung dennoch ein sehr gelungener Film..	0
Handkamera schön und gut, aber wenn es 2Min ununterbrochen nur wackelt und Lichtstrahlen rumschießen, vergeht das Sehvergnügen.	1
Fazit: Bei so einem teuren Case hätte man durchdachteres Design erwartet.	1
Ich bin jedenfalls voll zufrieden und glaube das FNM auf dieser Basis nochmal ein Paar wirklich gute Dinger schreiben könnte wenn sie dranbleiben	1
Mehr braucht man eigentlich nicht schreiben.	0
Ansich sieht die Maus schon klasse aus, aber die Verarbeitung lässt zu wünschen übrig.	0
Die Klangqualität läßt stark zu wünschen übrig!	0
Preis war gut,Ware ist Qualität.. Einzig nen aufbauhelfer müsste man noch Gratis haben :-)	1
Ich vermisse allerdings einen automatischen Reconnect wie bei meinen anderen Bluetooth-Uhren.	0
Es war am Anfang recht interessant, wie ER eventuell denken könnte!	1
Für das aussehen von dem Case würde ich 4 Sterne geben aber für die Passgenauigkeit könnte man von Null noch einen abziehen.	1
Die Scheibe hätte es nicht gebraucht, und ich versteh die ander zum Teil guten Rezessionen leider nicht, aber das scheint wohl der Einheitsgeschmack von heutigen am Mix-Computer-Einheitsbrei zu sein.	1
Klar, von nix kommt nix, aber statt einer LED Spielerei hätte man diese Produktionskosten nicht nur in bessere Kühler investieren können, sondern sogar MÜSSEN, wie ich finde.	1
CD hätte man seinerzeit 2 LPs/CDs zusammenstellen können, die beide zu den Top-Alben der Jethro Tull gezählt hätten !	1
Auch Tico Torres hätte so viel mehr mit den Drums machen können.	1
schöner Pop-Rocker zwischen Photograph und If everyone Cared  Midnight Queen:   Extrem Cooler Rocker ein Daniel der Drumming auf ein neues Level hebt und ein Sehr cooler Text schöner Dreckiger Sound   Gotta Get Me Some:   Interessanter Rocker der durch Mitwippzwang zu Fußgelenkschäden führt :D   Lullaby:   Auch wenn der Titel es sagen könnte defenetiv KEIN song zum einschlafen, sondern in meinen Ohren eine der schönsten Balladen ever nicht nur von Nickelback sondern generell!	1
Paßt gut, sieht urig aus, scheint hochwertig zu sein, nicht so teuer wie manche (dafür könnte man dann gleich eine Kindle e-Ink kaufen!	1
das arme Kind, traumatisiert stößt auf ein anderes traumatisiertes Kind - die geschichte wirkt daurch zu gewollt verworren	0
Es wäre natürlich möglich einen Zwischenstecker zu nehmen, aber dann ist der Zweck - sich frei bewegen zu können - wieder aufgehoben.	1
Ein 1 Meter Kabel wäre sinnvoller bzw.	1
Somit kann man sein iPhone gut hören wenn es mal klingelt und noch im Case steckt.	1
Es ist daher schon fraglich, warum das Blitzgerät überhaupt dieses AF-Hilfslicht hat, wenn es noch nicht einmal mit der hochwertigen X-S1 funktioniert.	0
Hätte ich nie erwartet das dieser Player mal zu meinen Alltime-Faves gehört!	1
Der Hubwagen ist NICHT enthalten und dann wäre es schön, wenn das auch so gekennzeichnet wäre.	1
Ich hätte nicht gedacht das diese Lautsprecher so gut sind.	1
Ich hätte ihn wahnsinnig gern behalten.. .	1
Aber ich könnte mir vorstellen, daß dieser Film sehr viele ansprechen wird.	1
6 Anläufe hat es gebraucht - Von Flipcase über Hardcase zu diversen Taschen/Hüllen bin ich dann endlich hier angelangt und hätte mich fast von den Rezensionen abhalten lassen, dieses Exemplar zu kaufen.	1
Der Preis ist dem entsprechend unangemessen hoch und dürfte nach meinen Einschätzungen eigentlich 25,- € nicht überschreiten dürfen.	1
Album wird, denn nach diesem guten behaupte ich einfach mal, dass es fast unmöglich ist, dieses Niveau zu halten, aber wenn es jemand schaffen kann, dann ist es Taylor Swift.	0
Ebenfalls die Filmmusik - besser als Hans Zimmer hätte es keiner gemacht.	1
könnte hier eher enttäuscht sein, bei mir ist es umgekehrt.	1
Auf diesem Geschwindigkeitslevel weitergemacht, wäre die Platte wie eine Atombombe eingeschlagen,.	1
Von der ersten Sekunde an müssen wir den Anblick eines weinerlichen Kindes ertragen und werden davon bis zuletzt nicht erlöst - obwohl der Darsteller in der vorletzten Szene scheinbar versucht die stoisch zuversichtliche Gefühlskälte des Vaters nachzustellen, was ihm aber nicht recht gelingt.	0
Man müsste das Buch mal von einem 14jährigen bewerten lassen.	1
